{
  "statusVersion": "OX-SD15-OPERATIONAL-STATUS-1",
  "modelId": "OX-MODEL-002",
  "status": "REJECTED_FOR_PRODUCTION",
  "technicalGate": "FAIL",
  "visualGate": "FAIL",
  "rejectionReason": "DOMINANT_BANDING_ARTIFACT",
  "role": null,
  "productionAlias": null,
  "productionAliasState": {
    "alias": "OX-GENESIS-MODEL-1",
    "state": "UNASSIGNED"
  },
  "historicalRegistration": {
    "candidateContractPreserved": true,
    "previousRole": "PRIMARY_LOCAL_BASE_MODEL",
    "previousProductionAlias": "OX-GENESIS-MODEL-1",
    "previousStatus": "CANDIDATE_FOR_FINAL_LOCAL_PRODUCTION",
    "supersededByOperationalStatus": true
  },
  "evidence": {
    "reference": "docs/local-generator/phase96-sd15-production-rejection-evidence.json",
    "evidenceHash": "sha256:6dc5c20a001a74e5c2dff457c01bf2c01d75397ec36e41a6091c4bbbcf7076b5",
    "attempts": 3,
    "qualityScore": 0
  },
  "artifacts": {
    "preserved": true,
    "deletionAllowed": false,
    "modelHash": "sha256:b8944e9fe0b69b36ae1b5bb0185b3a7b8ef14347fe0fa9af6c64c4829022261f",
    "externalVaeHash": "sha256:4fbcf0ebe55a0984f5a5e00d8c4521d52359af7229bb4d81890039d2aa16dd7c",
    "candidateImagesPreserved": true,
    "runtimeLogsPreserved": true,
    "telemetryPreserved": true,
    "receiptsPreserved": true
  },
  "governance": {
    "executionAllowed": false,
    "additionalRendersAllowed": false,
    "automaticRetryAllowed": false,
    "batchGenerationAllowed": false,
    "upscaleAllowed": false,
    "canonicalizationAllowed": false,
    "modelDownloadAllowed": false,
    "weightSubstitutionAllowed": false,
    "nextTokenAllowed": false,
    "nextBatchAllowed": false,
    "productionPromotionAllowed": false
  }
}
